No,Review
86,I work for a surgeon and getting surgery approvals for UHC is a nightmare. I recently had an urgent authorization for a patient needing immediate surgery. When I started the authorization I was told that it was started as expedited and that I would have an answer in 48 to 72 hours. That was a lie! It was never started as expedited. When I called to speak with a supervisor to find out why I was told that it was expedited when it wasn't the supervisor advised that it was and it was not.  I think she knew I was mad and just wanted me off the phone.When I called the next day because the surgery still had not been approved I was told that it had not been expedited and they would do that now and it would take 72 hrs before they received approval. I advised that was not okay because this was supposed to be expedited on the 27th of October and here it was 11/3 and it still has not been done. The rep advised that she would be able to get a supervisor which I at the time had requested. Keri the supervisor got on the phone and told me that she was not sure why the rep told me that this case was still pending because she showed it was approved. This was at 11AM. By 1PM I received a call from Scott the case manager working the case who advised that he was still reviewing the case and that it was not approved yet. He advised that he had just received the case this morning and it still was not expedited.I have been trying for five days now to get a rush put on this case and it has never been done. The patient's surgery is tomorrow and I have gotten nothing but the run around since day one. This is always the issue with any patient's that I am trying to get authorized and it is one constant lie after another from them. I would never recommend this company to anybody because they do not care about the well being of their patients. Worst Healthcare Company EVER!!! They do not care about the patients healthcare at all!
87,"We obtained pre-authorizations before using an in-network specialist. Nevertheless, for a month, they have denied our claims despite our having repeatedly sent them the payment receipts as well as scans and images of their own preauthorization letters. I’ve never before had such a disorganized and inappropriate customer service organization to deal with."
88,"I am a physical therapist in New York, and I have been in practice since 2000. I presently run several orthopedic practices in NYC, and we are out of network providers with United Healthcare. I am absolutely horrified at how unethical this insurance company has become in the past couple of years. However, 2021 has been the most abhorrent year, which is absolutely disgusting given the fact that we are in a pandemic and we healthcare workers are just trying to get by while taking care of the public. I am currently dealing with a number of claims that are being denied for various unbelievably unethical reasons. We are asked to submit notes constantly, which we upload as instructed on the United Healthcare portal, and then we are told time and time again that the notes ""were not received"" or ""were lost in the system."" We have spent countless hours on the phone with useless representatives, many of whom do not speak enough English to be understood, in order to try to sort out claims that should never have been denied in the first place. It is very clear to many of us healthcare practitioners that United healthcare workers are being instructed to ""make mistakes"" or deny claims in order to save the company money. Most recently, my claims are being audited and denied even after I have gotten prior authorization. When my biller calls to discuss this and to have the claims re-processed with the authorization number, the United representatives flat out refuse. Today, The UHC representative told my biller it was ""not her problem"" that the claims were processed incorrectly even though there was an authorization. WHAT!?!?Then this same representative literally hung up on my biller while she was trying to explain the situation. Of course I will be filing a complaint with the state insurance board; however, I hope this review serves as a warning to all individuals and companies who may be looking to use United Healthcare as their health insurance provider. To that I say RUN!! Run as far away as you can from this incredibly unethical company. They will charge you an exorbitant premium and deliver nothing on their end except empty promises. I truly do not know how the executives sleep at night knowing how deceptive their practices are, especially during a time when everybody should be working together in healthcare. We healthcare workers put ourselves on the front lines to keep America safe and this truly disgusting company is only adding to the stress we already face on a daily basis. SHAME SHAME SHAME ON THEM!"
89,My prescription went from $15 to $110.89 in one year. My zero deductible went up to $445. I am paying more out of pocket this year than I have in all the years I had this coverage put together. They change the tier and we pay the price. I have called. All I do is hold on. Representatives have no knowledge at all what or how to assist. If it was a choice I would have rated this plan a ZERO!
90,"I have worked for a Critical Illness Recovery Hospital (CIRH or LTAC) for 3 years. Our patients are referred from lower a level of care in hopes of receiving aggressive treatment to recover from an illness and regain their strength enough for rehab or return home. I would estimate nearly every UHC referral is denied by the insurance company. Even after P2Ps and Appeals (which take weeks), patients will die at the STAC. In my opinion, they consistently roll the dice with people's health to chance the patient might get better at a lower level, less expensive level of care, but I only time and time again see patients die while waiting for the appeal. All other insurances have reasonable responses within reasonable time to get the patient the treatment they need, while United Healthcare gambles with people’s lives to save money. Someone needs to be held accountable for these referral denials!"
91,"As a Disabled person, who has Mental Health Illnesses and Chronic Illnesses, my Healthcare is very important to me. I needed to find a Care Manager to assist me with finding Counseling Services plus Dental Services and A new Primary Doctor. UHC said they did all of that. I signed up with them and was immediately put into a Call BLOCK on my private cellphone where ALL my calls go to 1 unhelpful TINA S. who did nothing for me. NOTHING!I began trying to get the care I needed and could not find ANY PROVIDERS who would take UHC. Zero. I feel UHC has denied me the Crisis Counseling (5 Sessions) I have begged them for. I have begged them for Care Management. Instead they LIE AND LIE AND LIE CONSTANTLY. UHC does not provide ANY Case Management not to Me. Not ever. Zero counseling help. It appears they want to argue and control ALL of my private calls to make appointments. Everyone I talk to at UHC is in Atlanta, Georgia and they ALL LIE TO ME ABOUT EVERYTHING :(.I have filed complaints with Medicare and no one ever emails or calls, or writes me back. I believe UHC TINA S. who has inserted her Name on MY PHONE in Auto-fill as being at my Home Address and my Cell number is STEALING ALL OF MY CALLS AND EMAILS. I TRULY DO! How did this TINA S. get herself onto my private cellphone Auto-fill, when I try to enter MY Name it comes up as TINA S. This woman is a LIAR! As someone who lives independently and pays my own bills, and who has endured severe abuse; my independence matters. These controlling tactics by UHC are disturbing!The SEVERE PAIN BY THEM LYING TO ME IS VERY VERY BAD! THEY CAUSE ME to have MENTAL HEALTH CRISIS' just with their Messed up games and manipulation of my LIFE. Calling them at any time on any day leads to constant crisis and pain and suffering because they ARGUE, Waste my time - they do not do their job. I feel like I am calling 1-800-IDIOTS-R-US when I call them for anything. There appears to be Zero Government oversight or regulation regarding UHC Medicare's egregious misuse of Government funding.I have lost all hope in this Insurance company to ever do the right thing. It appears a bunch of Crooks and Clowns are running this Company that gets paid Millions of Government dollars in order to Care for its Members. I am a Member and they have caused me SEVERE PAIN AND SUFFERING ALL YEAR LONG. They have not helped me get the Care that I have begged and begged them for; very often crying, in severe mental distress. They want me to have a complete mental breakdown. To cause suffering of me is a terrible thing to do to me. I do not deserve their cruelty! No one does!"
92,"I called to inquire about my payment. After being transferred 3 times and 45 minutes later I was told I was talking to the wrong department. I was then transferred to the prescription department and disconnected. I called back the next day and told the agent what I was calling about, transferred to billing who didn't speak clear English, put on hold 3 times and finally after 1,5 hrs have up and hung up."
93,I called UHC last week to ask for counselling services. I was asked a series of questions then I was placed on hold without any notice just to be transferred from place to place for about 5 hours! Run!
94,"I contacted UHC for pre-approval for an appointment with Psychologist. They told me that all the ""out of network"" Psychologist services are fully covered in my plan. But after submitting the bills I was told that any consultation greater than 59 mins is not covered. Most of the consultation are for 1 hr so the limit of 59 mins was kept intentionally to reject the claims. That was also not explained during preapproval. Another issue mentioned by them to reject the claim was that the tax_id number should be of the doctor and not the facility. This was also not explained in advance."
95,"DO NOT USE THIS INSURANCE CARRIER if you plan on doing anything more than regular Dr. visits. Anything past routine Dr. visits will not be honored/covered, despite what they say. I have a Dr saying I need a surgery for my health and the chat rep said it was covered but when it came to the Dr. to verify coverage they have declined it twice. What am I paying for?!?!"
96,"They told me my plan would cover extraction, found out from dentist it doesn't. So I called UHC again, got additional coverage, they said would cover extraction but not so again. So I went round and round with them and now they say the manager call me in 2 days. They didn't want to switch me because I changed once already but it's because of you people at uhc who do not know your own plans well at all. Bad experience."
97,"The price is way too high for the coverage and the out of pocket expenses. Especially since people on the market place get it for little to no cost. By the time it’s all said and done, all of my income goes to medical bills. We make too much to qualify and not enough to survive. It’s not right, especially when you get closer to retirement."
98,United Healthcare’s Insurance plan has helped me cover all of my necessary health requirements plus offers the added benefits of annual health maintenance assessments which I just learned covers my monthly gym membership as well.
99,"So, I am 74 years old, retired with a pension from the Teachers Retirement System of Texas (TRS). I retired in 2002 and at that time TRS provided deal, vision and health insurance in different tiers of care. The higher the level you chose the more the premium cost. Three years into retirement and the dental and vision had gone away and the premiums for health care were more than I could afford. As soon as I was eligible for Medicare, I opted out of TRS and went with United Health Care the AARP program. Wow, what a difference. Health care, prescription drugs, dental and vision coverage all at a cost I could afford. All was well until I hit 73 years of age, now here I sit after three strokes and a heart attack. Still covered by the same policy.Yes I have had to pay my share but I am able to do that thanks to my retirement and supplemental coverage by the Veterans Administration, Army Veteran 68-69, and the premiums have not gone up. If I have a question, or I think a doctor is gouging me, I call United Health Care and they take care of the problem. They are really more than my insurance provider, they are my advocate for my health care needs. I don't even think about my health insurance anymore. I know it is covered."
100,"Great insurance overall, however I received a statement through mail, from a doctor in Nashville TN. Not detailing what the visit was for and dated 1-10-21. More detailed billing information on statements would be helpful."