No,Review
64,"Adding rudeness to incompetence makes for a new low in UHC customer care. I, and other relatives, will likely not renew with UHC next year as a consequence. Briefly, I was told by my provider of a $345 estimated copay for a test procedure. I called UHC customer service to understand how that number was arrived at (and whether I should change anything such as facility...)The first “advocate” I got was totally unhelpful, left me on hold for 8 minutes with no communication and when returning with no useful information abruptly put me on “music on hold” as I was mid-sentence. That level of rudeness is simply unacceptable. I called again and requested to speak with a supervisor. The much more polite person contacted a supervisor and asked me to wait while in parallel trying to sort out my very simple request. 30 minutes later, she was still unable to provide useful information and no supervisor was still available. I asked for a supervisor call back. 24hrs later I am still waiting.Good customer service is more than relabelling agents as “advocates”.  It is                                                                                                Not leaving customers on hold for several minutes with no feedback.                                                                                                Not hanging up on a customer by rudely putting them on hold.                                                                                                Having agents (advocates they are not) be able to answer simple questions regarding the breakdown of a copay.                                                                                                Having supervisors available when a customer requests speaking with them. Having supervisors call back when requested to do so.I realize UHC treat customer care as a cost center whose cost is to be optimized... but I suggest they look at top-line cost of poor customer service as customers choose other healthcare providers."
65,"I purchased a Critical Illness policy over 2 years ago, before COVID. Last Oct I was hospitalized with COVID. I had Viral Pneumonia and blood clots in my lungs. My bill was almost 10k and my policy covered up to 40k. After about 5 months of submitting claims, they denied all payment! They said COVID was covered under critical care! I was furious! I've never been so disappointed in health care as I am today. Never ever get insurance through United Health Care!!"
66,"UHC is by far the worst customer experience I have ever had with ANY company. Period. And it was at the expense of my wife's mental health. Incorrect information given multiple times, un-ethical practices with changing coverage mid-year, hours on the phone, and appeals unanswered after weeks of being submitted. The only way I can understand that they are still in business is that they offer low prices because they absolutely do not care about customers and with health insurance laws we are helpless to make any changes outside of open enrollment. I am filing a formal ethics complaint with the my state."
67,"Almost every single day for the last year I have received junk mail for Medicare. I have called the company several times to be taken off their mailing list. I do not need, nor want, Medicare as I am a veteran and all my medical, vision, and dental needs are taken care of through the VA. Even one of UHCs that I spoke to was unaware of this and she said her husband and father are veterans. It's sad that I have to education one of your people. My last call was transferred to AARP. The call before that the representative was nothing but argumentative. When I asked for a supervisor she put me on hold for 13 minutes then disconnected the call. And you think I would even consider doing business with a company like this even if I needed/wanted Medicare? You are sorely mistaken."
68,"UHC Administration Staff are poorly trained, inconsistent, inefficient with answering questions about claims and processing claims. There are too many hands in the processing of claims making it very confusing for UHC and for the customer. I have 34 claims of out of network reimbursements since beginning of May 2021 and only receive reimbursement for 6 claims out of the 34 early on then as months went on nothing. UHC gave me lame excuses like their machine that takes the forms came out blurry on their end, or some went through processing and others didn't because certain reps got confused and denied some, then they need treatment records, then a weeks go by and need more info on the treatment records and it goes on. Almost like they do this to see if people will give up and they don't have to reimburse. I have spent 30+ hours including long calls and emails to UHC. I kept good notes and sent everything to the Commissioner of Labor and spoke to HR. Finally I think they are expediting my claims. I received one check for 3 claims. Now I just need about 20 more to be reimbursed. We pay a lot for our healthcare and NO one should ever have to go through this!"
69,"I had the unfortunate experience of having United Health Care for 8 months last year and it was the most negative experience I have ever had with an insurance company. My husband says watching me interact with United healthcare is like watching a real life Lifetime Movie. In short, United Healthcare looks to find any and every reason to deny coverage instead of helping someone who really needs it. Issue 1. I needed a minor procedure done. My doctor called United healthcare and gave them the codes for a procedure and the doctor was told it would be covered. So I made the appointment. United healthcare paid the claim and then reversed it citing the codes used as the issue. My doctor has appealed this twice since they used the same codes they initially called about, and United healthcare continues to deny it. I now have to pay for the procedure out of pocket. That cost is $800.Issue 2. I was in physical therapy and when my physical therapist's office called about the number of visits, they were never told of the policy that they had to submit a request for more visits at visit 21. The max you are allowed is 25 and apparently I went over by 1. United healthcare is denying my 26th visit citing their policy. My medical practice is charging me the full amount of the visit and claim they did their due diligence by calling. They told me I have to submit an appeal. I know from experience appeals get denied by United as I have had this happen on every occasion I have submitted something. So this is another $310 I will be having to pay a different doctor.Issue 3. I have hypermobility syndrome which means my bones just move out of place for good reason, bad reason, or no reason at all. There is 1 doctor in this area who treats this and they do not take insurance. I submitted a request for gap coverage since they are the only doctor who can provide the care I need. My gap coverage was denied, providing other doctors to see. I called their offices and they said they don’t treat hypermobility syndrome (the person who took my appeal information never put my primary diagnosis on the gap coverage). So I appealed it. And United still came back with a denial and more doctors' names in network I could visit. However, I called those doctors and they too said they cannot provide the treatments I need. I gave up with the appeals process since it was evident I would not make any progress here. So I submitted my bills as out of network claims. I have only submitted the first 3 of many, and I cannot even get these visits covered. They have been denied 3 times, citing coding does not comply with MARS. My doctor's office has said they have not had this issue with any other insurance company and have tried working with United Healthcare. My doctor's office said they thought they worked it out and resubmitted 2 of the claims on my behalf and they should be accepted this time. However, I just got another denial letter in the mail again citing coding. Bottom line, you will pay a lot of money and get nothing in return but headaches if you choose United Healthcare as your insurance. I had a different insurance company most of my life and I never had any of these types of issues with them. I have since switched back and am so thankful I did."
70,"I have been given false and incorrect information from United Healthcare Hearing time after time, including from a supervisor. After 7 phone calls, I am finally informed that yes, I was given false information more than once before, including from a supervisor. Sorry. That's it. They are incompetent."
71,"I'm pretty familiar with United Healthcare. I wanted to switch to mail-order. I had an old $30 balance & I was told that they would override the payment in order to get crucial medication until I was able get the payment from 7 yrs ago taken care of. The customer service representative are untrained in handling complicated calls. Instead of handling the call correctly they lied and said they override my payment for crucial meds. They're free anyways. This was a serious life threatening situation, and you'd rather lie and get me off the phone instead of handling the call. It's important to me that you care about your customers. Whatever you do represents United Healthcare. I'd fire the person that gave me false information, and me to think my situation was taken care of. I like the fact 7 yrs ago when I done the mail order pharmacy they were on time with the orders, but I start getting my packages taken.I feel this was an issue where they were too lazy to correctly respond to the call & giving me false info was one of the those ""Whatever I got to do to get her off the phone."". You don't play games like. I know you have your company policies, but never give false information. I needed those medications. As the days go by I'd pray I didn't have a stroke. I worried about how would I care for myself if that happened. I never ask for an override & the medications were free. So basically you lead me to believe you didn't care. You must care about your clients. That behavior was inappropriate & showed lack of empathy or sympathy. I will never forget this time of waiting. A complete nightmare. That wouldn't of cost you any $s. Just a little concern & empathy."
72,"United Healthcare Medicare plan told me I have Medical coverage in other states. As I got sick on vacation in another state I got a total bill, because united only covers home town/state. United also talked me in to schedule house call visit and to receive $70 in credit card. First visit person lied that she was there and she couldn’t been there, due to our dogs, plus I waited hours. United did not honor promise and had to rescheduled appt. Appt was beginning Nov 2021, now Feb 2022. After 2 complaints and 3 calls I still have not received card. United also told me I have free gym excess anywhere in USA which was so in 2021, but they no longer have silver sneakers and therefore only have gym in hometown and not where vacationing any longer. Dental benefits has also decreased and lose of coverage. Hearing aid coverage is no longer available. Customer service lied, gave me wrong info, and hung up on me at numerous calls to get info."
73,"Have had this insurance for years and now when I need the catheterization they are stalling. Case was marked URGENT and it’s been 14 days of stalling, miscommunication, and confusion on United’s part. Customer service tells me computers are not updating. Called again and said nothing was submitted. Doc said did submit. Third call took 56 minutes!! And was told now they want more info and a peer to peer call (as if my doc office has nothing to do but talk with them when they have 50 other patients to schedule.) Called again was told didn’t need ANY authorization due to cardiac issue. Still getting run around. When their staff forgot to put their phone on mute, I heard them say “This is why people are pissed at us. WE don’t even know what we are doing”. POOR Recommendation."
74,"I had a stroke in 2017, May. It took the right side out at 75% leaving me with left side foot drop and left arm negotiation problems. Recently I have been able to, with a walker, get up and down steps, mow my grass with a zero turn mower and get back to the woodworking shop. I had to explain to UHC via their support line why we thought Botox Shots would help, they finally said they would help pay for it. I was thankful for that help. Unfortunately it didn't help long term. It is a must to push yourself and trust yourself that it can be done. I don't know what I would do without UHC as they have helped me with other things also. Thanks for listening. Insurance under any circumstances is a must. Fortunately I am retired."
75,"Got a new account via the exchange. Can't sign in to new account because it defaults to old one. Been trying to get a hold of customer service for a week and a half. More than eight hours on the phone with various customer service agents from various departments, from old department to new one to IT to web services. No one can fix it. No one offers any kind of solution. At most they tell me to keep trying and maybe it'll be fixed next time. No solutions. They simply do not care."
76,"Medicare takes a big bite out of my income whether I choose UHC or not. The customer service even during Covid era, has been great, where other companies are extremely lacking. They haven't been able to lower my co-payments for specialist visits, but they do try to encourage me to maintain better health with $ quota of free OTC merchandise as well as bonuses for annual physicals and flu shots. I believe this company has been very customer focused when others have not."
77,High deductible plans have created the atmosphere that we feared the most. More cost sharing is not what the people wanted. We wanted more freedom to decide what health services we wanted and our physicians to decide what is needed. Some procedure are arbitrarily denied based on algorithms that were created based on conditions that don't necessarily apply for everyone. The human body is complex and should not be looked at as a one size fits all model
78,"Ask what's going on and you tell them, but they don't get it unless you are about to jump off a bridge or hurt yourself, if none apply it's like, ""How can we help you"" and but not if it was their family or love one. This alone may send you to the bridge to jump. All that's wants to be really answered is, ""Are you thinking about hurting yourself or someone."" In having started/had my own support group for women, there's a lack of understanding that someone's life in your hands could mean the difference between life and death for that person. I felt like I had no one to really listen to what I was saying [I'm mentally, emotionally and physically broken-exhausted]. WHO cares not many health care professionals. After that call it put energy back into my soul to try and help anyone man or woman to learn to encourage yourself because you never know who the other person on the other side of that line is or their intent. Are they getting you off the call for a break or lunch or the end of their day to go home. Are they there just to have a income or is it truly from their heart and something they enjoy doing. Have they ever experienced a mental breakdown, which not even required a ER visit. What was it like to truly lose someone that they loved with their whole earthly being. No most are beyond feeling for anyone that they don't know personally except their own, calmly thinking next. Yes they don't know us from Adam or Eve, they wouldn't know us if we walked right up to them. True therapist/counselors feel with their heart/mind and not their want to just take the next call although we wouldn't know it, but they are there looking you in your face watching your reactions. Not these persons, although there's some very good counselors whom you will never meet but they will always stay in your heart because of the empathy and kindness through their voice and voice only, because you never meet them. Everyone and anyone has to be mindful of the powers, we have within our selves without having to rely on persons whom may not have our best interests at heart and my call to the behavioral mental health department today brought it back to me full circle. I will never ever again give???? that power again, no matter my outcome, life or death. Only God has that will and power. My life good and/or bad means more to me than the paycheck???? makes off of having me as a client. I truly hope that the recording is pulled and listened to. Someone's family whom may have the fund's and ability to address these types of insults and injustice practices will not let it just go and their love one is no longer a part of this earthly world as a result of neglect on???? We have put an end to negativity when it comes to our health care and well-being. Good Luck as we all go about making better health care systems & plans. I wasn't really sure if I could use the name of the health care company so I removed it to try and be safe and make all aware of the powers we have within ourselves until we can get to trusted professionals with taught education to guide me along the way. Good emergency help is out there so keep a backup plan just in case you're ever in a mentally dysfunctional state of mind."
79,"BTW, I AM STILL SLEEP DEPRIVED. My prescription from my doctor was on 11/18/2021. It is now December 10th and UHC continues to block paying for it. THAT’S 28 DAYS. WTF? BTW, I AM STILL SLEEP DEPRIVED. Have been on the phone multiple times for hours trying to get United Health Care to approve payment on my prescribed medicine. Originally my doc wrote a script AND pre-authorization for ** to Walgreens pharmacy. Unfortunately, Walgreens errored and sent in a request to UHC for payment of a “generic” **. Good catch, or so I thought. After even more time spent on the phone with a UHC customer service rep last night, everything was supposed to be “Resolved”. He called Walgreens, explained the situation and said he verbally gave the go ahead. You can imagine my shock and anger when Walgreens put in the request for payment for ** to UHC this morning and it was DENIED. More phone calls. Then they just told me to START ALL OVER AGAIN. I’m to call my doctor and have her write the same prescription again and write the same pre-authorization. EVEN THOUGH THEY HAVE THE ORIGINALS! BTW, I AM STILL SLEEP DEPRIVED."
80,"Health insurance world is complex and United Health Care Company makes it more convoluted. I UHC took my monthly premium payment of $1,349 and refused to cover a much needed double hernia surgery. I am attaching the ""paragraph"" in my United Health insurance policy that they are hanging their theory on for not covering the cost of my hernia surgery. They claim that unless it is an emergency hernia surgery is not covered. My condition met the criteria of emergency based on their definition. They define ""Emergency"" as defined as: 1.) recent onset and severity including but not limited to severe pain (my pain began and has increased over the last few months causing me to see Dr. ** for his professional medical advice), diagnosed and call for correction coming from a prudent layperson, (Dr ** would qualify...lol, and his recommendation is to take care of the condition sooner than later), failure of me addressing the issues can result in placing my ""health in serious jeopardy"" (Dr. ** told me that if I did not address this problem that it can become strangulated. Doctor **, and every article I read online, states that strangulation is serious and even life threatening.) Based on the above evidence and United's own definition for emergency I believe that this surgery should be covered but I was wrong. They stole over $13,000 in ten months from me and would not cover the needed hernia surgery. Should be criminal!"
81,I went to my in network dentist in october 2021 for dental work. United Health Care contract with my dentist expired in June 2021. Like I am suppose to know that!! Who terminates a contract in mid year. I spent over 2 hours on the phone trying go get them to pay. I had to pay out of my own pocket!!! I am running away from this company. Going to either anthem or devoted. They have better coverage anyway.
82,"United Health Care is surely the worst insurance company that I have ever dealt with. Their internal system is messy, they keep declining claims for random reasons that they never notify customers. When calling up, the customer service lady was extremely rude, spending time arguing with the customers, instead of listening and trying to help. Emails sent to them always got ignored and you have to call up to go through the worst customer service again. Their service surely ruins your day. Even when the claims were approved, their cover is extremely minimal. I'm honestly impressed how such a terrible company still can be in the business!"
83,"Over the course of the last couple of months, I have spent over 20 hours on the phone with UHC representatives in order to sign up for my extended cobra benefits. I have ALWAYS been the beneficiary of UHC insurance for my husband and me. Despite that, UHC had my husband registered as the beneficiary, I called to have this changed to my SS # and make me the beneficiary. I found out when I went to log in that they changed the data to my son's SS# and made him a beneficiary! He is not even on the plan!!!!As instructed I sent UHC operations an email to make the corrections again, with bolded, all caps type to fix this, and now I find the application switched back to my husband's SS#. I have never been able to speak to a manager, and coincidently, I have never been able to take the post-call survey in spite of waiting online after each phone call. I am currently on the phone with UHC this AM, for 55 minutes to try and get this resolved AGAIN. Extremely incompetent and unnerving that this is the company that is managing my healthcare benefits. BEWARE."
84,"After copious research, and having received multiple mailings from UHC since last March when they discovered I was on both Medicare and Level 1 MassHealth (Medicaid), urging me to enroll in their Senior Care Options (HMO D-SNP) dual eligible plan, I called them on 10/18 hoping to do just that. That day their CSR Rochelle told me a certified sales agent was going to call me. When that didn't happen, I called again on 10/26 at which time their CSR ""Malia"" made the same promise. Lacking any call by 11/5, I filled out a enrollment application at the UHC website and mailed it in.With no call to date, I contacted UHC on 11/16 and this time was introduced on the phone to a Josh who identified himself as a certified sales agent, but who claimed--despite the information at the UHC website and the multiple UHC mailings to me--that UHC offered no SNP plans in all of MA. Knowing he didn't know his job in that respect, but unable to get anywhere with him, I called again today and talked to a Demi who identified himself as a certified sales agent and who was most helpful in verifying most of my qualifications for the plan, but was nevertheless forced to transfer me to another CSR who identified herself as Chaniqua (sp?) who could only offer, she said, to make another appt. for a certified sales agent to call me.Doubtful from a month of experience that such a call back will actually occur before the 12/7/21 enrollment deadline, I called back a second time and talked to a CSR named Bonnie who could only promise the same. Still the UHC snail mail ads urging me to enroll continue to barrage my mailbox. Question: is UHC genuinely interested in my business? If not, why can't they at least call me back to tell me so? In the absence of a timely response from UHC, I am left with only one option in the next 20 days: go with one of the less preferred SNP plans of their local competitors such as Tufts or Commonwealth Care Alliance. Are you going to force me to do that, United Healthcare?"
85,Transportation by Modivcare is absolutely the worst people to schedule trips. They route our calls across seas and the people who book our Transportation. They never get it right and hang up the phone or transfer you to someone who can't help. It takes a 30 minutes sometimes 60 minutes to book a simple trip. I can't handle the unprofessional callers...
